Name	Type	SaveFileId	Alternate ID	Metadata	TODO
Trophy (Park Row, Under Car Near Beginning)	Riddler Trophies	PickedUp_OWA_Pickup_31			
Rescue Jack Ryder	Political Prisoner	ArkhamBullyR2_JackRyder_Saved			
Rescue Catwoman	Main Story	TwofaceObjectionFinished			
Camera (Park Row, Next to Courthouse)	Breakable Cameras (Park Row)	PickedUp_OWA_Camera_5			
Camera (Park Row, Near Lounge near courthouse)	Breakable Cameras (Park Row)	PickedUp_OWA_Camera_7			
Camera (Park Row, Near Church)	Breakable Cameras (Park Row)	PickedUp_OWA_Camera_10			
Zsasz start/Church	Main Story	Ch2_Church_HarleyGone			
Trophy (Church, Confessional)	Riddler Trophies	PickedUp_OWA_Pickup_19			
Trophy (Church, Near Entrance)	Riddler Trophies	PickedUp_OWA_Pickup_16			
Trophy (Church, Path to Belltower)	Riddler Trophies	PickedUp_OWA_Pickup_17			
Trophy (Park Row, QuestionMark After Belltower)	Riddler Trophies	PickedUp_OWA_Pickup_11			
Camera (Park Row, by phone)	Breakable Cameras (Park Row)	PickedUp_OWA_Camera_11			
Trophy (Amusement, 6 question mark gel)	Riddler Trophies	PickedUp_OWB_Pickup_13			
Balloon (Amusement, Gotham Casino)	Balloons (Amusement)	PickedUp_OWB_Balloons_1		IGNORE_GAP	
Balloon (Amusement, GCR)	Balloons (Amusement)	PickedUp_OWB_Balloons_3			
Trophy (Industrial, next to phone [get with Zsasz call])	Riddler Trophies	PickedUp_OWC_Pickup_6			
Balloon (Industrial, Path to AR training)	Balloons (Industrial)	PickedUp_OWC_Balloons_1			
Balloon (Amusement, On Bridge)	Balloons (Amusement)	PickedUp_OWB_Balloons_5			
AR Training 1	AR Training	ARChallenge1_Complete			
Trophy (Amusement, 3 buttons)	Riddler Trophies	PickedUp_OWB_Pickup_32			
AR Training 2	AR Training	ARChallenge2_Complete			
Camera (Industrial, east of phone)	Breakable Cameras (Industrial)	PickedUp_OWC_Camera_5			
AR Training 3	AR Training	ARChallenge3_Complete			
Trophy (Amusement, Under Bridge)	Riddler Trophies	PickedUp_OWB_Pickup_26			
Camera (Amusement, On Bridge)	Breakable Cameras (Amusement)	PickedUp_OWB_Camera_9			
Camera (Industrial, NorthWest)	Breakable Cameras (Industrial)	PickedUp_OWC_Camera_1			
Camera (Industrial, Behind Truck)	Breakable Cameras (Industrial)	PickedUp_OWC_Camera_3			
Camera (Industrial, Alley near AR4 [north])	Breakable Cameras (Industrial)	PickedUp_OWC_Camera_2			
AR Training 4	AR Training	ARChallenge4_Complete			
Trophy (Industrial, 13524 43152 35214)	Riddler Trophies	PickedUp_OWB_Pickup_31			
Camera (Amusement, Before Bridge)	Breakable Cameras (Amusement)	PickedUp_OWB_Camera_10			
Grapnel Boost	AR Training	ARChallenge_Grapple_Boost_Collected			
Balloon (Industrial, Tricorner Naval Sign)	Balloons (Industrial)	PickedUp_OWC_Balloons_7			
Balloon (Industrial, Super Dodgems Roof))	Balloons (Industrial)	PickedUp_OWC_Balloons_9			
Camera (Industrial, Funland Gate)	Breakable Cameras (Industrial)	PickedUp_OWC_Camera_8			
AR Challenge 5	AR Training	ARChallenge5_Complete			
Trophy (Industrial, Low Water Glide Cage)	Riddler Trophies	PickedUp_OWC_Pickup_36			
Balloon (Industrial, Steel Mill)	Balloons (Industrial)	PickedUp_OWC_Balloons_11			
Trophy (Steel Mill, Entrance)	Riddler Trophies	PickedUp_Steel_Pickup_1			
Trophy (Steel Mill, Bumper Cars Vent)	Riddler Trophies	PickedUp_Steel_Pickup_9			
Trophy (Steel Mill, Bumper Cars Freeze Nade)	Riddler Trophies	PickedUp_Steel_Pickup_10			
Trophy (Steel Mill, Smelting Chamber in Pipe)	Riddler Trophies	PickedUp_Steel_Pickup_14 			
Trophy (Steel Mill, Center of Smelting Chamber)	Riddler Trophies	PickedUp_Steel_Pickup_12			
Trophy (Steel Mill, Wall Behind Smelting Office)	Riddler Trophies	PickedUp_Steel_Pickup_13			
Harley Head (Steel Mill, Smelting Office)	Harley Head	PickedUp_Steel_HarleyHead_7			
Harley Head (Steel Mill, Assembly Line before loading bay)	Harley Head	PickedUp_Steel_HarleyHead_4			
Trophy (Industrial, Rec Gun Ball)	Riddler Trophies	PickedUp_OWC_Pickup_13			
Trophy (Industrial, Ferris Wheel)	Riddler Trophies	PickedUp_OWC_Pickup_12			
Balloon (Industrial, Sionis)	Balloons (Industrial)	PickedUp_OWC_Balloons_10			
Camera (Industrial, Steel Mill Gate)	Breakable Cameras (Industrial)	PickedUp_OWC_Camera_7			
Balloon (Industrial, Ferris Wheel)	Balloons (Industrial)	PickedUp_OWC_Balloons_5			
Camera (Industrial, Joker Funland Sign/phone)	Breakable Cameras (Industrial)	PickedUp_OWC_Camera_6			
Balloon (Industrial, Joker's Funland Sign)	Balloons (Industrial)	PickedUp_OWC_Balloons_6			
Azrael (Ferris Wheel)	Azrael	SS_Azrael_C3_Glyph2a	SS_Azrael_GlyphScanned2		
Trophy (Industrial, Timed Switch near Ferris Wheel)	Riddler Trophies	PickedUp_OWC_Pickup_14			
Camera (Industrial, west of phone [with crane])	Breakable Cameras (Industrial)	PickedUp_OWC_Camera_4			
Trophy (Amusement, Raise Crane)	Riddler Trophies	PickedUp_OWB_Pickup_33			
AR Challenge 7	AR Training	ARChallenge7_Complete			
Start Bane	Bane	SS_Bane_FirstConvo			
Trophy (Amusement, Bane Room)	Riddler Trophies	PickedUp_OWB_Pickup_34			
Trophy (GCPD, Electric Batarang) [storage trick]	Riddler Trophies	PickedUp_OWB_Pickup_36			
Riddler Church	Riddler Mission	SS_Riddler_OrganScanned			
Aaron Cash Riddle	Riddles	PickedUp_OWA_Riddle_7			
Trophy (Park Row, Roof Punch Wood Wall)	Riddler Trophies	PickedUp_OWA_Pickup_26			
Ace Chemicals Riddle	Riddles	PickedUp_OWA_Riddle_15			
Trophy (Bowery, 6 Questionmarks under bridge)	Riddler Trophies	PickedUp_OWE_Pickup_14			
Camera (Bowery, Subway Platform)	Breakable Cameras (Bowery)	PickedUp_OWE_Camera_2			
Trophy (Bowery, Rec gun gate in Alley)	Riddler Trophies	PickedUp_OWE_Pickup_13			
Camera (Bowery, Near rec gun Gate)	Breakable Cameras (Bowery)	PickedUp_OWE_Camera_8			
Trophy (Bowery, Glide to Wall under Museum)	Riddler Trophies	PickedUp_OWE_Pickup_27			
Trophy (Bowery, Other wall under museum)	Riddler Trophies	PickedUp_OWE_Pickup_26			
Camera (Bowery, Museum)	Breakable Cameras (Bowery)	PickedUp_OWE_Camera_3			
Hat Shop Riddle	Riddles	PickedUp_OWE_Riddle_4			
Penguin (Museum, right of entrance)	Penguins	PickedUp_Museum_Penguin_1			
Camera (Bowery, Across from Museum)	Breakable Cameras (Bowery)	PickedUp_OWE_Camera_11			
Jammer 3	Main Story	Ch3c_OW_D3_Jammer_Panel_3			
Jammer 2	Main Story	Ch3c_OW_A8_Jammer_Panel_3			
Trophy (Bowery, Corner Building near shockwave dive)	Riddler Trophies	PickedUp_OWE_Pickup_10			
Jezebel Center Riddle	Riddles	PickedUp_OWE_Riddle_11			
Jammer 1	Main Story	Ch3c_OW_E5_Jammer_Panel_3			
Trophy (Bowery, Bridge next to Jammer)	Riddler Trophies	PickedUp_OWE_Pickup_11			
Trophy (Museum, Gel Wall Dino Room)	Riddler Trophies	PickedUp_Museum_Pickup_2			
Penguin (Museum, Dino Room)	Penguins	PickedUp_Museum_Penguin_2			
Trophy (Museum, Dino Room Ceiling)	Riddler Trophies	PickedUp_Museum_Pickup_3			
Penguin (Museum, Freeze Room Lobby)	Penguins	PickedUp_Museum_Penguin_8			
Hyena Riddle	Riddles	PickedUp_Museum_Riddle_4			
Abramovici Riddle	Riddles	PickedUp_Museum_Riddle_5			
Titan Container (Museum)	Bane	Museum_C2.RTitanCrate_4.Broken			
Penguin (Museum, Path to Predator)	Penguins	PickedUp_Museum_Penguin_7			
Penguin (Museum, Center Predator Room)	Penguins	PickedUp_Museum_Penguin_9			
Trophy (Museum, Hack under Bridge)	Riddler Trophies	PickedUp_Museum_Pickup_17			
Trophy (Museum, Hack Far Right)	Riddler Trophies	PickedUp_Museum_Pickup_23			
Penguin (Museum, Right of Center Predator Room)	Penguins	PickedUp_Museum_Penguin_10			
Trophy (Museum, Predator Room Right Upper)	Riddler Trophies	PickedUp_Museum_Pickup_19			
Trophy (Museum, Rec gun path to Predator)	Riddler Trophies	PickedUp_Museum_Pickup_13			
Grundy Fight	Main Story	CH4_Museum_C1_NinjasBlood			
Teeth (Subway, Right side of Predator)	Joker Teeth	PickedUp_OWD_Teeth_7			
Santa Prisca Riddle	Riddles	PickedUp_OWD_Riddle_4			
Trophy (Subway, Right side of predator room lower	Riddler Trophies	PickedUp_OWD_Pickup_16			
Trophy (Subway, Subway car)	Riddler Trophies	PickedUp_OWD_Pickup_14			
Trophy (Subway, Electric Switch Right of Predator)	Riddler Trophies	PickedUp_OWD_Pickup_17			
Trophy (Subway, Hack under gargoyle)	Riddler Trophies	PickedUp_OWD_Pickup_15			
Trophy (Subway, fly through wall)	Riddler Trophies	PickedUp_OWD_Pickup_11			
Trophy (Subway, Grate Room Left of Entrance)	Riddler Trophies	PickedUp_OWD_Pickup_12			
Teeth (Subway, Predator Room Entrance from Industrial)	Joker Teeth	PickedUp_OWD_Teeth_5			
Trophy (Subway, Corner Terminal Rec door)	Riddler Trophies	PickedUp_OWD_Pickup_18			
Trophy (Subway, Hack Wonder Tower Door)	Riddler Trophies	PickedUp_OWD_Pickup_20			
Trophy (Wonder Tower, Collapsed South Freeze Pipes)	Riddler Trophies	PickedUp_Underworld_Pickup_2			
Trophy (Wonder Tower, Collapsed South Gel Batclaw)	Riddler Trophies	PickedUp_Underworld_Pickup_5			
Trophy (Wonder Tower, Collapsed South Upper Room Ceiling)	Riddler Trophies	PickedUp_Underworld_Pickup_6			
Titan Container (Wonder Tower)	Bane	Under_A3.RTitanCrate_3.Broken			
Globe Riddle	Riddles	PickedUp_Underworld_Riddle_2			
Demon Seal (Wonder, Elevator)	Demon Seals	PickedUp_Underworld_DemonSeal_1			
Demon Seal (Wonder, West Elevator Room)	Demon Seals	PickedUp_Underworld_DemonSeal_12			
Trophy (Wonder Tower, Gel East Elevator Room)	Riddler Trophies	PickedUp_Underworld_Pickup_11			
Trophy (Wonder Tower, East lower level)	Riddler Trophies	PickedUp_Underworld_Pickup_10			
Demon Seal (Wonder, Wonder City Entrance)	Demon Seals	PickedUp_Underworld_DemonSeal_2			
Demon Seal (Wonder, Wonder City Corridor)	Demon Seals	PickedUp_Underworld_DemonSeal_4			
Demon Seal (Wonder, Wonder City Corridor)	Demon Seals	PickedUp_Underworld_DemonSeal_3			
Trophy (Wonder, Right of Corridor near Robot)	Riddler Trophies	PickedUp_Underworld_Pickup_19			
Trophy (Wonder, Line Launch 3 Switches)	Riddler Trophies	PickedUp_Underworld_Pickup_18			
Gotham City Times Riddle	Riddles	PickedUp_Underworld_Riddle_3			
Trophy (Wonder, Stroller)	Riddler Trophies	PickedUp_Underworld_Pickup_22			
Trophy (Wonder, Across Question Mark)	Riddler Trophies	PickedUp_Underworld_Pickup_21			
Demon Seal (Wonder, Wonder City end of Corridor)	Demon Seals	PickedUp_Underworld_DemonSeal_5			
Trophy (Wonder, Questionmark Gel)	Riddler Trophies	PickedUp_Underworld_Pickup_20			
Trophy (Wonder Tower, Wonder City Mine)	Riddler Trophies	PickedUp_Underworld_Pickup_23			
Trophy (Wonder, Left Chamber Door)	Riddler Trophies	PickedUp_Underworld_Pickup_24			
Grundy Riddle	Riddles	PickedUp_Underworld_Riddle_4			
Statue Riddle	Riddles	PickedUp_Underworld_Riddle_5			
Demon Seal (Wonder, By Exit Door)	Demon Seals	PickedUp_Underworld_DemonSeal_8			
Demon Seal (Wonder, By Exit Door)	Demon Seals	PickedUp_Underworld_DemonSeal_7			
Demon Seal (Wonder, Pothole)	Demon Seals	PickedUp_Underworld_DemonSeal_6			
Trophy (Wonder Tower, Collapsed West Questionmark Gel)	Riddler Trophies	PickedUp_Underworld_Pickup_17			
Trophy (Bowery, Gel Mine)	Riddler Trophies	PickedUp_OWE_Pickup_16			
Camera (Bowery, Quincy Sharp Alley)	Breakable Cameras (Bowery)	PickedUp_OWE_Camera_6			
Quincy Sharp Riddle	Riddles	PickedUp_OWE_Riddle_5			
Azrael (Bowery)	Azrael	SS_Azrael_E6_Glyph4	SS_Azrael_GlyphScanned3		
Trophy (Bowery, Brainpower hack near subway)	Riddler Trophies	PickedUp_OWE_Pickup_35			
Camera (Park Row, Near Stripclub near courthouse) [Zsasz 2]	Breakable Cameras (Park Row)	PickedUp_OWA_Camera_6		IGNORE_GAP	
Balloon (Amusement, Olympus)	Balloons (Amusement)	PickedUp_OWB_Balloons_2		IGNORE_GAP	
Olympus Riddle	Riddles	PickedUp_OWB_Riddle_6			
Trophy (Amusement, GCPD Gel Door)	Riddler Trophies	PickedUp_OWB_Pickup_21			
Trophy (Amusement, Wood Wall GCPD) [Batclaw Through Fence]	Riddler Trophies	PickedUp_OWB_Pickup_22			
Trophy (GCPD, Hack Door)	Riddler Trophies	PickedUp_OWB_Pickup_38			
Trophy (GCPD, Switches)	Riddler Trophies	PickedUp_OWB_Pickup_35			
Gordon Parking Spot Riddle	Riddles	PickedUp_OWB_Riddle_7			
Camera (Amusement, GCPD Door)	Breakable Cameras (Amusement)	PickedUp_OWB_Camera_5			
Trophy (Amusement, Outside GCPD Hack)	Riddler Trophies	PickedUp_OWB_Pickup_23			
Trophy (Amusement, Roof next to GCPD)	Riddler Trophies	PickedUp_OWB_Pickup_16			
Balloon (Amusement, Gotham Casino Dice)	Balloons (Amusement)	PickedUp_OWB_Balloons_7			
Camera (Amusement, Next to phone Casino)	Breakable Cameras (Amusement)	PickedUp_OWB_Camera_3		IGNORE_GAP	
Camera (Amusement, Casino Terrace)	Breakable Cameras (Amusement)	PickedUp_OWB_Camera_12			
Camera (Amusement, Ivy)	Breakable Cameras (Amusement)	PickedUp_OWB_Camera_11			
Camera (Amusement, Next to snipers)	Breakable Cameras (Amusement)	PickedUp_OWB_Camera_6			
Trophy (Amusement, Timed Question Marks on Water)	Riddler Trophies	PickedUp_OWB_Pickup_12			
Camera (Amusement, Sea Pier)	Breakable Cameras (Amusement)	PickedUp_OWB_Camera_4			
Circus Riddle	Riddles	PickedUp_OWB_Riddle_4			
Rescue Vicki Vale	Main Story	Ch6_OW_R7_Vicki_Vale_Rescued			
Trophy (Amusement, 2 wood walls near Vicki)	Riddler Trophies	PickedUp_OWB_Pickup_5			
Azrael (Amusement)	Azrael	SS_Azrael_B4_Glyph1	SS_Azrael_GlyphScanned4		
Trophy (Amusement, Red Green Switch in front of Bane)	Riddler Trophies	PickedUp_OWB_Pickup_18			
Trophy (Amusement, Rec Gun Ball Next to Deadshot Victim)	Riddler Trophies	PickedUp_OWB_Pickup_19			
Camera (Amusement, Bridge)	Breakable Cameras (Amusement)	PickedUp_OWB_Camera_2			
Balloon (Amusement, Before Bridge)	Balloons (Amusement)	PickedUp_OWB_Balloons_4			
Deadshot Victim 1	Deadshot	SS_DeadShot_Hobo1Dead			
Trophy (Amusement, GCR)	Riddler Trophies	PickedUp_OWB_Pickup_20			
Trophy (Industrial, 3 switch tower)	Riddler Trophies	PickedUp_OWC_Pickup_4			
Balloon (Industrial, Crane)	Balloons (Industrial)	PickedUp_OWC_Balloons_2			
Trophy (Industrial, Dive bomb near city wall)	Riddler Trophies	PickedUp_OWC_Pickup_3			
Trophy (Industrial, Gel Rec near dive bomb switch)	Riddler Trophies	PickedUp_OWC_Pickup_2			
Wonder Tower Riddle	Riddles	PickedUp_OWE_Riddle_2			
Deadshot Casing Found	Deadshot	SS_DeadShot_Hobo1_BulletCasingScanned			
Trophy (Industrial, Lower Crane)	Riddler Trophies	PickedUp_OWC_Pickup_1			
Trophy (Industrial, Wood Wall Sionis)	Riddler Trophies	PickedUp_OWC_Pickup_35			
Trophy (Industrial, Side of Steel Mill)	Riddler Trophies	PickedUp_OWC_Pickup_26			
Trophy (Industrial, Steel Mill Gel)	Riddler Trophies	PickedUp_OWC_Pickup_27			
Trophy (Industrial, Hard to Reach City Wall)	Riddler Trophies	PickedUp_OWC_Pickup_37			
Black Mask Riddle	Riddles	PickedUp_OWC_Riddle_7			
Balloon (Industrial, Big Toy Soldier)	Balloons (Industrial)	PickedUp_OWC_Balloons_12			
Camera (Industrial, Steel Mill Predator)	Breakable Cameras (Industrial)	PickedUp_OWC_Camera_9			
Trophy (Industrial, Rec Train Gel)	Riddler Trophies	PickedUp_OWC_Pickup_33			
Balloon (Industrial, Excavator)	Balloons (Industrial)	PickedUp_OWC_Balloons_8		IGNORE_GAP	Map this to a political prisoner
Camera (Industrial, Super Dodgems)	Breakable Cameras (Industrial)	PickedUp_OWC_Camera_11			
Trophy (Industrial, Spinning Wheel Question Marks)	Riddler Trophies	PickedUp_OWC_Pickup_29			
Titan Container (Industrial)	Bane	OW_RC5_ChB1.RTitanCrate_7.Broken			
Trophy (Industrial, Gel Wall Hack near Titan)	Riddler Trophies	PickedUp_OWC_Pickup_30			
Trophy (Industrial, Death Ride)	Riddler Trophies	PickedUp_OWC_Pickup_34			
Camera (Industrial, Death Ride)	Breakable Cameras (Industrial)	PickedUp_OWC_Camera_10			
Trophy (Industrial, City Wall near Steal Mill)	Riddler Trophies	PickedUp_OWC_Pickup_28			
Harley Head (Steel Mill, Entrance)	Harley Head	PickedUp_Steel_HarleyHead_11			
Titan Container (Steel Mill)	Bane	Steel_C4.RTitanCrate_2.Broken			
Trophy (Steel Mill, Alcove Near Entrance)	Riddler Trophies	PickedUp_Steel_Pickup_22			
Trophy (Steel Mill, Hack Near Water)	Riddler Trophies	PickedUp_Steel_Pickup_21			
Trophy (Steel Mill, Question Mark Vent before fight)	Riddler Trophies	PickedUp_Steel_Pickup_20			
Gothcorp Cryogenics Riddle	Riddles	PickedUp_Steel_Riddle_6			
Harley Head (Steel Mill, After Fight Cooling B)	Harley Head	PickedUp_Steel_HarleyHead_10			
Harley Head (Steel Mill, Cooling D After Fight)	Harley Head	PickedUp_Steel_HarleyHead_9			
Trophy (Steel Mill, Electric Batarang Pipe)	Riddler Trophies	PickedUp_Steel_Pickup_19			
Trophy (Steel Mill, Cooling D Ceiling Grapple)	Riddler Trophies	PickedUp_Steel_Pickup_18			
Question Mark Riddle (Steel Mill)	Riddles	PickedUp_Steel_Riddle_1			
Trophy (Steel Mill, Cooling D Ceiling Batclaw)	Riddler Trophies	PickedUp_Steel_Pickup_17			
Trophy (Steel Mill, Pull Grate)	Riddler Trophies	PickedUp_Steel_Pickup_16			
Hammer Riddle	Riddles	PickedUp_Steel_Riddle_5			
Harley Head (Steel Mill, Stacey 2)	Harley Head	PickedUp_Steel_HarleyHead_8			
Trophy (Steel Mill, Stacey 2 Cart)	Riddler Trophies	PickedUp_Steel_Pickup_15			
Joker Riddle	Riddles	PickedUp_Steel_Riddle_4			
Harley Head (Steel Mill, Smelting Predator)	Harley Head	PickedUp_Steel_HarleyHead_6			
Trophy (Steel Mill, Assembly Line Gel)	Riddler Trophies	PickedUp_Steel_Pickup_11			
Twins Riddle	Riddles	PickedUp_Steel_Riddle_3			
Harley Head (Steel Mill, Assembly Line Office)	Harley Head	PickedUp_Steel_HarleyHead_5		IGNORE_GAP	
Trophy (Steel Mill, Hack)	Riddler Trophies	PickedUp_Steel_Pickup_3			
Trophy (Steel Mill, In Floor)	Riddler Trophies	PickedUp_Steel_Pickup_2			
Trophy (Steel Mill, Pipe near Elevator)	Riddler Trophies	PickedUp_Steel_Pickup_6			
Trophy (Steel Mill, Under Elevator)	Riddler Trophies	PickedUp_Steel_Pickup_8			
Harley Head (Steel Mill, Cluster Grenade Room)	Harley Head	PickedUp_Steel_HarleyHead_12			
Trophy (Steel Mill, Penguins)	Riddler Trophies	PickedUp_Steel_Pickup_23			
Box of Tricks Riddle	Riddles	PickedUp_Steel_Riddle_7			
Freeze Cluster Grenade	Freeze Cluster Grenade	Ch6_ClusterBombCollected			
Trophy (Steel Mill, Explosive Gel Freeze Cluster Room)	Riddler Trophies	PickedUp_Steel_Pickup_24			
Harley Head (Steel Mill, Before Freeze Cluster Room)	Harley Head	PickedUp_Steel_HarleyHead_3			
Trophy (Steel Mill, Elevator Ceiling)	Riddler Trophies	PickedUp_Steel_Pickup_7			
Harley Head (Steel Mill, Loading Bay Corner)	Harley Head	PickedUp_Steel_HarleyHead_1			
Trophy (Steel Mill, Behind Fan and Lava)	Riddler Trophies	PickedUp_Steel_Pickup_5			
Trophy (Steel Mill, Behind Fan)	Riddler Trophies	PickedUp_Steel_Pickup_4			
Harley Outfit Riddle	Riddles	PickedUp_Steel_Riddle_2			
Harley Head (Steel Mill, Joker Room)	Harley Head	PickedUp_Steel_HarleyHead_2			
Trophy (Subway, Line Launch after impossible room)	Riddler Trophies	PickedUp_OWD_Pickup_22			
Teeth (Subway, After line launch)	Joker Teeth	PickedUp_OWD_Teeth_4			
Trophy (Subway, Frozen Water Wonder Tower Door)	Riddler Trophies	PickedUp_OWD_Pickup_19			
Teeth (Subway, Wonder Tower Door)	Joker Teeth	PickedUp_OWD_Teeth_6		IGNORE_GAP	
Gotham City Plaque Riddle	Riddles	PickedUp_Underworld_Riddle_6			
Demon Seal (Wonder Tower, Elevator Entrance)	Demon Seals	PickedUp_Underworld_DemonSeal_9			
Demon Head (Wonder Tower, Elevator Shaft)	Demon Heads	PickedUp_Underworld_DemonSeal_11			
Trophy (Wonder Tower, Side of building)	Riddler Trophies	PickedUp_Underworld_Pickup_25			
Demon Seal (Wonder Tower, Elevator Shaft)	Demon Seals	PickedUp_Underworld_DemonSeal_10			
Question Mark Riddle (Wonder Tower)	Riddles	PickedUp_Underworld_Riddle_1			
Trophy (Wonder Tower, Near Top)	Riddler Trophies	PickedUp_Underworld_Pickup_26			
Tyger Brain (Bowery)	Tyger Brains	PickedUp_OWE_CameraControl_1			
Tyger Brain (Park Row)	Tyger Brains	PickedUp_OWA_CameraControl_1			
Clayface Fight	Main Story	Ch8_Entered_Theatre			
Trophy (Bowery, Rec gun sphere)	Riddler Trophies	PickedUp_OWE_Pickup_28			
Trophy (Bowery, Lower Level Near Back of Museum Phone)	Riddler Trophies	PickedUp_OWE_Pickup_12			
Trophy (Bowery, Timed Slide)	Riddler Trophies	PickedUp_OWE_Pickup_9			
Trophy (Park Row, Dive Shockwave)	Riddler Trophies	PickedUp_OWA_Pickup_28			
Camera (Bowery, Jezebel Center)	Breakable Cameras (Bowery)	PickedUp_OWE_Camera_10			
Ivy Plant Shop Riddle	Riddles	PickedUp_OWA_Riddle_9			
Camera (Park Row, Across from Plant Riddle)	Breakable Cameras (Park Row)	PickedUp_OWA_Camera_1			
Tyger Vault Riddle	Riddles	PickedUp_OWA_Riddle_8			
Trophy (Park Row, 2 mine disrupts)	Riddler Trophies	PickedUp_OWA_Pickup_29			
Camera (Bowery, Gotham Bank)	Breakable Cameras (Bowery)	PickedUp_OWE_Camera_12			
Camera (Park Row, Alley near beginning)	Breakable Cameras (Park Row)	PickedUp_OWA_Camera_3			
Puppet Riddle (Bowery)	Riddles	PickedUp_OWE_Riddle_8			
Trophy (Bowery, Gel Wall Near Ace)	Riddler Trophies	PickedUp_OWE_Pickup_20			
Trophy (Bowery, Fly Wood Wall near City Wall)	Riddler Trophies	PickedUp_OWE_Pickup_18			
Arkham City Plaque Riddle	Riddles	PickedUp_OWE_Riddle_6			
Trophy (Bowery, Wonder Tower Wall)	Riddler Trophies	PickedUp_OWE_Pickup_22			
Camera (Bowery, City Wall Near Quincy Sharp)	Breakable Cameras (Bowery)	PickedUp_OWE_Camera_5			
Trophy (Bowery, Hack Building Across Wonder Tower Entrance)	Riddler Trophies	PickedUp_OWE_Pickup_34			
Trophy (Bowery, 3 switches near hush body)	Riddler Trophies	PickedUp_OWE_Pickup_33			
Hush 1	Hush	SS_Hush_Victim1_HoboConv			
Best Behavior Tyger Riddle	Riddles	PickedUp_OWE_Riddle_9			
Trophy (Bowery, City Wall Bottom Left)	Riddler Trophies	PickedUp_OWE_Pickup_32			
Camera (Bowery, Across from City Wall Trophy)	Breakable Cameras (Bowery)	PickedUp_OWE_Camera_4			
Trophy (Bowery, Remote Batarang Vent)	Riddler Trophies	PickedUp_OWE_Pickup_31			
Trophy (Bowery, 3 switches gliding)	Riddler Trophies	PickedUp_OWE_Pickup_30			
Camera (Bowery, Near Subway)	Breakable Cameras (Bowery)	PickedUp_OWE_Camera_7			
Titan Container (Bowery, Near Subway)	Bane	OW_E6_ChB19.RTitanCrate_6.Broken			
Trophy (Bowery, Gel Wall after 3 switches)	Riddler Trophies	PickedUp_OWE_Pickup_29			
Trophy (Bowery, Building Left Across from Museum)	Riddler Trophies	PickedUp_OWE_Pickup_17			
Trophy (Bowery, Wonder Tower Entrance Mirror)	Riddler Trophies	PickedUp_OWE_Pickup_37			
Trophy (Wonder Tower, Collapsed West Freeze Water Batclaw)	Riddler Trophies	PickedUp_Underworld_Pickup_13			
Trophy (Wonder Tower, Collapsed West Corner Platform)	Riddler Trophies	PickedUp_Underworld_Pickup_15			
Trophy (Wonder Tower, Collapsed West Hack on Wall)	Riddler Trophies	PickedUp_Underworld_Pickup_14			
Trophy (Wonder Tower, Collapsed West Frozen on Water)	Riddler Trophies	PickedUp_Underworld_Pickup_16			
Trophy (Bowery, Wonder Tower Entrance hack door)	Riddler Trophies	PickedUp_OWE_Pickup_39			
Trophy (Bowery, Wonder Tower Entrance Gel)	Riddler Trophies	PickedUp_OWE_Pickup_38			
Dead Guard Riddle	Riddles	PickedUp_OWE_Riddle_10			
Trophy (Bowery, Wonder Tower Entrance Water)	Riddler Trophies	PickedUp_OWE_Pickup_36			
Question Mark Riddle (Wonder Tower Entrance)	Riddles	PickedUp_OWE_Riddle_1			
Trophy (Bowery, Subway car)	Riddler Trophies	PickedUp_OWE_Pickup_15			
Camera (Bowery, Gotham Bank)	Breakable Cameras (Bowery)	PickedUp_OWE_Camera_9			
Maroni Riddle	Riddles	PickedUp_OWE_Riddle_3			
AR Challenge 6	AR Training	ARChallenge6_Complete			
Trophy (Subway, vent gel upper station)	Riddler Trophies	PickedUp_OWD_Pickup_4			
Teeth (Subway, Upper station)	Joker Teeth	PickedUp_OWD_Teeth_11			
Trophy (Subway, Hack upper station)	Riddler Trophies	PickedUp_OWD_Pickup_2			
Teeth (Subway, Middle of lower station)	Joker Teeth	PickedUp_OWD_Teeth_12			
Trophy (Subway, in grate lower station)	Riddler Trophies	PickedUp_OWD_Pickup_3			
Vicki Vale Riddle	Riddles	PickedUp_OWD_Riddle_2			
Trophy (Subway, Vent near Vicki poster)	Riddler Trophies	PickedUp_OWD_Pickup_1			
Trophy (Subway, hack subway car behind door)	Riddler Trophies	PickedUp_OWD_Pickup_5			
Teeth (Subway, In front of vent)	Joker Teeth	PickedUp_OWD_Teeth_10			
Teeth (Subway, On top of subway car)	Joker Teeth	PickedUp_OWD_Teeth_9			
Trophy (Behind Subway Car)	Riddler Trophies	PickedUp_OWD_Pickup_6			
Subway Question Mark Riddle	Riddles	PickedUp_OWD_Riddle_1			
Titan Container (Subway)	Bane	OW_D2_ChB19.RTitanCrate_5.Broken			
Grundy Riddle	Riddles	PickedUp_OWD_Riddle_3			
Trophy (Subway, Electric Floor Room)	Riddler Trophies	PickedUp_OWD_Pickup_9			
Trophy (Subway, Electric Floor Room)	Riddler Trophies	PickedUp_OWD_Pickup_10			
Trophy (Subway, Electric Floor Room)	Riddler Trophies	PickedUp_OWD_Pickup_8			
Trophy (Subway, Timed switch 3 questionmarks)	Riddler Trophies	PickedUp_OWD_Pickup_7			
Teeth (Subway, Before Titan Door)	Joker Teeth	PickedUp_OWD_Teeth_8			
Trophy (Wonder Tower, Collapsed South Hack Door)	Riddler Trophies	PickedUp_Underworld_Pickup_8			
Trophy (Wonder Tower, Collapsed South Freeze Water)	Riddler Trophies	PickedUp_Underworld_Pickup_7			
Trophy (Wonder Tower, Hack)	Riddler Trophies	PickedUp_Underworld_Pickup_9			
Trophy (Wonder Tower, Collapsed South Across Door)	Riddler Trophies	PickedUp_Underworld_Pickup_3			
Trophy (Wonder Tower, Collapsed South Grapnel Boost)	Riddler Trophies	PickedUp_Underworld_Pickup_4			
Trophy (Wonder Tower, Collapsed South Room up top)	Riddler Trophies	PickedUp_Underworld_Pickup_1			
Trophy (Subway, Impossible)	Riddler Trophies	PickedUp_OWD_Pickup_24			
Trophy (Subway, Impossible)	Riddler Trophies	PickedUp_OWD_Pickup_25			
Trophy (Subway, Impossible)	Riddler Trophies	PickedUp_OWD_Pickup_26			
Teeth (Subway, After Impossible room)	Joker Teeth	PickedUp_OWD_Teeth_3			
Trophy (Subway, Freeze Nade under bridge)	Riddler Trophies	PickedUp_OWD_Pickup_23			
Trophy (Subway, Line Launch)	Riddler Trophies	PickedUp_OWD_Pickup_21			
Croc Riddle	Riddles	PickedUp_OWD_Riddle_5			
Teeth (Subway, After Trophy)	Joker Teeth	PickedUp_OWD_Teeth_2			
Trophy (Subway, Electric Switch)	Riddler Trophies	PickedUp_OWD_Pickup_27			
Teeth (Subway, Industrial entrance)	Joker Teeth	PickedUp_OWD_Teeth_1			
Trophy (Industrial, Under Excavator)	Riddler Trophies	PickedUp_OWC_Pickup_21		IGNORE_GAP	Map this to a political prisoner
Trigger Deadshot 2 (Industrial)	Deadshot	SS_DeadShot_Victim2GunShot 			
Trophy (Industrial, 3 switches near Subway)	Riddler Trophies	PickedUp_OWC_Pickup_20		IGNORE_GAP	Map this to a political prisoner
Trophy (Industrial, Alley Super Dodgems [gel])	Riddler Trophies	PickedUp_OWC_Pickup_23			
Trophy(Industrial, Alley Super Dodgems  [hack])	Riddler Trophies	PickedUp_OWC_Pickup_24			
Camera (Industrial, Across Super Dodgems)	Breakable Cameras (Industrial)	PickedUp_OWC_Camera_12			
